,Unnamed: 0,ADDRESS,CITY,COMPENSATION,CONTRIBUTIONS,EIN,EXPENSES,FIPS,FULL_ADDRESS,NAME,NTEECC,PROGREVENUE,REVENUE,STATE,STREET_ADDRESS,ZIP,ZIP5,nteeFinal,SUBDISCIPLINE
0,915,245 PARK AVE,NEW YORK,0,0,10902003,3175515,36061.0,245 PARK AVE NEW YORK NY 10167-0002,PHOENIX CORPORATE TOWER FUNDING COMPANY INC,A60,3175515.0,3175515,NY,245 PARK AVE,10167-0002,10167.0,,Performing Arts
1,916,PO BOX 5005,NEW YORK,0,0,10902004,2492000,36061.0,,CORNERSTONE TERRACE FUNDING COMPANY INC,A60,2492000.0,2492000,NY,,10163-0000,10163.0,,Performing Arts
2,917,PO BOX 5005,NEW YORK,0,0,10902008,2842000,36061.0,,DULLES STATION FUNDING COMPANY INC,A60,2842000.0,2842000,NY,,10163-0000,10163.0,,Performing Arts
3,2650,8347 242ND ST,BELLROSE,0,72618,30560682,54281,36081.0,8347 242ND ST BELLROSE NY 11426-1317,RAJPUT CULTURAL SOCIETY OF NORTH AMERICA,A23,0.0,72618,NY,8347 242ND ST,11426-1317,11426.0,,Cultural & Ethnic Awareness
4,4091,166 MADISON AVE FL 5,NEW YORK,0,0,42565109,291270,36061.0,166 MADISON AVE NEW YORK NY 10016-5432,AFRICA THE AFRICAN TRAVEL ASSOCIATION INC,A23,286078.0,286190,NY,166 MADISON AVE,10016-5432,10016.0,,Cultural & Ethnic Awareness
5,8624,PO BOX 5005,NEW YORK,0,0,61597372,2241019,36061.0,,LAKEMONT INDUSTRIAL HOLDING COMPANY,A60,7361742.0,7390692,NY,,10163-5005,10163.0,,Performing Arts
6,9462,PO BOX 22,BROOKLYN,129990,0,111195683,637522,36047.0,,POLISH NATIONAL ALLIANCE OF BROOKLYN U S A,A23,67658.0,289367,NY,,11222-0022,11222.0,,Cultural & Ethnic Awareness
7,9651,730 BROADWAY,NEW YORK,0,0,111854964,1114131,36061.0,730 BROADWAY NEW YORK NY 10003-9502,LOCAL 522 IND ROOFING & SHEETMETAL CRAFTS WELFARE FUND,A40,1420831.0,1522990,NY,730 BROADWAY,10003-9502,10003.0,,Visual Arts
8,9756,2366 CONEY ISLAND AVE,BROOKLYN,0,0,112022650,131755,36047.0,2366 CONEY ISLAND AVE BROOKLYN NY 11223-5002,AUTO BODY CRAFTSMENS GUILD INC,A40,135180.0,135180,NY,2366 CONEY ISLAND AVE,11223-5002,11223.0,,Visual Arts
9,10038,1110 BRONX RIVER AVE,BRONX,0,0,112579110,45789,36005.0,1110 BRONX RIVER AVE BRONX NY 10472-3102,NEW YORK OIL HEAT SERVICE MANAGERS ASSOCIATION INC,A65,40382.0,40382,NY,1110 BRONX RIVER AVE,10472-3102,10472.0,,Theater
10,10127,1401 BLONDELL AVE,BRONX,211957,0,112689446,355411,36005.0,1401 BLONDELL AVE BRONX NY 10461-2622,PRODUCTION INDUSTRIAL TECHNICAL,A60,336689.0,336689,NY,1401 BLONDELL AVE,10461-2622,10461.0,,Performing Arts
11,10129,1401 BLONDELL AVE,BRONX,244887,0,112691482,6371254,36005.0,1401 BLONDELL AVE BRONX NY 10461-2622,PRODUCTION INDUSTRIAL TECH TEXTILE & PROF EMPLOYEES LOC 124 WLFR FUND,A40,6406293.0,6409355,NY,1401 BLONDELL AVE,10461-2622,10461.0,,Visual Arts
12,10207,4602 30TH AVE,ASTORIA,0,0,112803536,20933,36081.0,4602 30TH AVE ASTORIA NY 11103-1264,BORGETTO CULTURAL ASSOC M S S ADDOLORATA DEL ROMITELLO INC,A23,0.0,8149,NY,4602 30TH AVE,11103-1264,11103.0,,Cultural & Ethnic Awareness
13,10375,7254 65TH PL,GLENDALE,0,0,113097379,253893,36081.0,7254 65TH PL GLENDALE NY 11385-6930,SERBIAN ASSOCIATION OF NEW YORK INC,A23,83250.0,250847,NY,7254 65TH PL,11385-6930,11385.0,,Cultural & Ethnic Awareness
14,10398,,,0,334,113123913,34046,36081.0,,MALTESE CTR INC,A23,12600.0,39865,NY,,11102,11102.0,,Cultural & Ethnic Awareness
15,10431,PO BOX 2222,NEW YORK,0,0,113163244,8095,36061.0,,COUNCIL OF BARBADIAN ORGANIZATIONS INC NEW YORK,A23,300.0,1807,NY,,10008-2222,10008.0,,Cultural & Ethnic Awareness
16,10466,35-30 FARRINGTON ST 2FL,FLUSHING,0,233075,113212678,232361,36081.0,35-30 FARRINGTON ST FLUSHING NY 11354-2827,KOREAN-AMERICAN NAIL SALON ASSOCIATION OF NEW YORK INC,A23,0.0,233075,NY,35-30 FARRINGTON ST,11354-2827,11354.0,,Cultural & Ethnic Awareness
17,10468,1324 FLATBUSH AVE,BROOKLYN,12000,0,113216404,119361,36047.0,1324 FLATBUSH AVE BROOKLYN NY 11210-1233,CARIBBEAN CUP INC,A23,115706.0,115706,NY,1324 FLATBUSH AVE,11210-1233,11210.0,,Cultural & Ethnic Awareness
18,10479,,,0,0,113234458,68622,36081.0,,MOVEMENT OF THE CHILDREN DANCENTER INC,A62,67840.0,67840,NY,,11436,11436.0,,Dance
19,10484,8101 FURMANVILLE AVE,MIDDLE VLG,0,0,113238845,52497,36081.0,8101 FURMANVILLE AVE MIDDLE VLG NY 11379-2315,A I A QUEENS INC,A40,17961.0,48855,NY,8101 FURMANVILLE AVE,11379-2315,11379.0,,Visual Arts
20,10496,4503 37TH ST,LONG IS CITY,0,94985,113261970,89052,36081.0,4503 37TH ST LONG IS CITY NY 11101-1801,KOREAN AIR CONDITIONING AND REFRIGERATION ASSOCIATION OF NEW,A23,0.0,94985,NY,4503 37TH ST,11101-1801,11101.0,,Cultural & Ethnic Awareness
21,10504,800 FOOD CENTER DR UNIT 96B,BRONX,0,41920,113278319,53517,36005.0,800 FOOD CENTER DR UNIT BRONX NY 10474-0060,KOREAN SEAFOOD ASSOCIATION OF NEW YORK INC,A23,0.0,41920,NY,800 FOOD CENTER DR UNIT,10474-0060,10474.0,,Cultural & Ethnic Awareness
22,10506,10 ROCKEFELLER PLZ STE 900,NEW YORK,0,0,113281373,132480,36061.0,10 ROCKEFELLER PLZ NEW YORK NY 10020-1903,IRISH AMERICAN BUILDING SOCIETY INC,A23,149766.0,151265,NY,10 ROCKEFELLER PLZ,10020-1903,10020.0,,Cultural & Ethnic Awareness
23,10552,27 04 PARSONS BLVD,FLUSHING,0,94228,113383944,84364,36081.0,27 04 PARSONS BLVD FLUSHING NY 11354-1343,KOREAN MEDICAL PRACITIONER ASSOC OF GREATER NEW YORK INC,A23,0.0,94416,NY,27 04 PARSONS BLVD,11354-1343,11354.0,,Cultural & Ethnic Awareness
24,10603,2227 33RD ST,ASTORIA,0,8995,113477797,144469,36081.0,2227 33RD ST ASTORIA NY 11105-2402,SYLLOGOS KRETON MINOS INC,A23,0.0,115656,NY,2227 33RD ST,11105-2402,11105.0,,Cultural & Ethnic Awareness
25,10985,200 EASTERN PKWY,BROOKLYN,3514,0,116042353,111077,36047.0,200 EASTERN PKWY BROOKLYN NY 11238-6052,AMERICAN FEDERATION OF STATE COUNTY & MUNICIPAL EMPLOYEES,A50,115164.0,115771,NY,200 EASTERN PKWY,11238-6052,11238.0,,Museums
26,11033,10916 JAMAICA AVE,RICHMOND HILL,100667,0,116102176,216080,36081.0,10916 JAMAICA AVE RICHMOND HILL NY 11418-2334,NATIONAL ASSOCIATION OF LETTER CARRIERS,A23,0.0,214627,NY,10916 JAMAICA AVE,11418-2334,11418.0,,Cultural & Ethnic Awareness
27,11111,432 PARK AVE S FL 6,NEW YORK,3207445,0,130417765,6578858,36061.0,432 PARK AVE S NEW YORK NY 10016-8013,ADVERTISING RESEARCH FOUNDATION INC,A03,6481170.0,6830948,NY,432 PARK AVE S,10016-8013,10016.0,,Professional Societies & Associations
28,11141,50 E 42ND ST RM 506,NEW YORK,0,0,130453215,166432,36061.0,50 E 42ND ST NEW YORK NY 10017-5436,PAINTING & DECORATING CONTRACTORS OF AMERICA,A40,100863.0,91351,NY,50 E 42ND ST,10017-5436,10017.0,,Visual Arts
29,11199,275 7TH AVE 18TH FLR,NEW YORK,0,0,130876693,8710,36061.0,275 7TH AVE NEW YORK NY 10001-6708,UNITED ITALIAN AMERICAN LABOR COUNCIL INC,A23,1965.0,4628,NY,275 7TH AVE,10001-6708,10001.0,,Cultural & Ethnic Awareness
30,11211,6 E 87TH ST,NEW YORK,77426,92000,130971750,126139,36061.0,6 E 87TH ST NEW YORK NY 10128-0505,LIEDERKRANZ OF THE CITY OF NEW YORK,A6A,43582.0,135832,NY,6 E 87TH ST,10128-0505,10128.0,,Opera
31,11252,299 BROADWAY STE 206,NEW YORK,48089,0,131101367,188680,36061.0,299 BROADWAY NEW YORK NY 10007-4107,NEW YORK SOCIETY OF ARCHITECTS,A03,161217.0,181772,NY,299 BROADWAY,10007-4107,10007.0,,Professional Societies & Associations
32,11308,7 E 235TH ST,BRONX,0,0,131426099,39817,36005.0,7 E 235TH ST BRONX NY 10470-1901,UNITED IRISH COUNTIES ASSOCIATION OF NEW YORK INC,A23,760.0,19328,NY,7 E 235TH ST,10470-1901,10470.0,,Cultural & Ethnic Awareness
33,11328,536 LAGUARDIA PL,NEW YORK,1059202,0,131505524,3140295,36061.0,536 LAGUARDIA PL NEW YORK NY 10012-1401,AMERICAN INSTITUTE OF ARCHITECTS,A40,1115552.0,3221279,NY,536 LAGUARDIA PL,10012-1401,10012.0,,Visual Arts
34,11369,1230 AVE OF THE AMERICAS 7THFL,NEW YORK,30859,9000,131589984,116902,36061.0,1230 AVE OF THE AMERICAS NEW YORK NY 10020-0000,WOOLMARK AMERICAS INC,A60,97797.0,108684,NY,1230 AVE OF THE AMERICAS,10020-0000,10020.0,,Performing Arts
35,11718,1000 5TH AVE,NEW YORK,17906,0,131956457,369848,36061.0,1000 5TH AVE NEW YORK NY 10028-0113,AMERICAN FEDERATION OF STATE COUNTY & MUNICIPAL EMPLOYEES,A50,413700.0,419921,NY,1000 5TH AVE,10028-0113,10028.0,,Museums
36,11772,45 W 14TH ST,NEW YORK,0,0,132534897,250186,36061.0,45 W 14TH ST NEW YORK NY 10011-7419,PAINTING INDUSTRY FUND BUILDING CORP,A40,325171.0,330593,NY,45 W 14TH ST,10011-7419,10011.0,,Visual Arts
37,11975,360 MADISON AVE STE 15FL,NEW YORK,0,0,132877623,183115,36061.0,360 MADISON AVE NEW YORK NY 10017-7111,FIXED INCOME ANALYSTS SOCIETY INC HARRHANSEN MGMT INC,A01,184177.0,188932,NY,360 MADISON AVE,10017-7111,10017.0,,Alliances & Advocacy
38,12093,243 5TH AVE,NEW YORK,0,0,132990527,101216,36061.0,243 5TH AVE NEW YORK NY 10016-8703,MUSIC PUBLISHERS ASSOCIATION OF THE UNITED STATES INC,A68,219395.0,221880,NY,243 5TH AVE,10016-8703,10016.0,,Music
39,12172,NY TERMINAL MARKET ROOM C27,BRONX,0,0,133071647,117977,36005.0,NY TERMINAL MARKET BRONX NY 10474-0000,KOREAN PRODUCE ASSOCIATION INC,A23,118340.0,118340,NY,NY TERMINAL MARKET,10474-0000,10474.0,,Cultural & Ethnic Awareness
40,12240,27 W 20TH ST STE 601,NEW YORK,0,41827,133131629,46974,36061.0,27 W 20TH ST NEW YORK NY 10011-3728,ADVERTISING PHOTOGRAPHER OF AMERICA INC,A40,0.0,41845,NY,27 W 20TH ST,10011-3728,10011.0,,Visual Arts
41,12246,3625 BAINBRIDGE AVE,BRONX,0,0,133132781,117841,36005.0,3625 BAINBRIDGE AVE BRONX NY 10467-1168,3680 HOLDING COMPANY INC,A60,117826.0,117841,NY,3625 BAINBRIDGE AVE,10467-1168,10467.0,,Performing Arts
42,12264,14602 89TH AVE,JAMAICA,3980,0,133154895,72405,36081.0,14602 89TH AVE JAMAICA NY 11435-3638,INDIAN DENTAL ASSOCIATION USA INC,A23,86785.0,93439,NY,14602 89TH AVE,11435-3638,11435.0,,Cultural & Ethnic Awareness
43,12292,420 LEXINGTON AVE RM 2034,NEW YORK,71726,0,133183002,388085,36061.0,420 LEXINGTON AVE NEW YORK NY 10170-0012,ARAB BANKERS ASSOCIATION OF NORTH AMERICA INC,A23,472240.0,479606,NY,420 LEXINGTON AVE,10170-0012,10170.0,,Cultural & Ethnic Awareness
44,12300,101 W 23RD ST 2343,NEW YORK,0,0,133190575,27981,36061.0,101 W 23RD ST NEW YORK NY 10011-2490,AMERICAN SOCIETY OF MEDIA PHOTOGRAPHERS INC,A40,38918.0,38917,NY,101 W 23RD ST,10011-2490,10011.0,,Visual Arts
45,12334,56 W 45TH ST STE 705,NEW YORK,21600,0,133211019,354643,36061.0,56 W 45TH ST NEW YORK NY 10036-4215,INDIAN DIAMOND & COLORSTONE ASSOC INC,A23,342750.0,348911,NY,56 W 45TH ST,10036-4215,10036.0,,Cultural & Ethnic Awareness
46,12374,32 BROADWAY STE 1114,NEW YORK,0,0,133251595,15394,36061.0,32 BROADWAY NEW YORK NY 10004-1612,GRAPHIC ARTISTS GUILD OF NEW YORK,A40,27198.0,27205,NY,32 BROADWAY,10004-1612,10004.0,,Visual Arts
47,12397,201 E 17TH ST APT 28J,NEW YORK,0,1029,133302569,43013,36061.0,201 E 17TH ST NEW YORK NY 10003-3681,NEW YORK DIVISION ELECTRIC RAILROADERS ASSOCIATION,A54,38662.0,40353,NY,201 E 17TH ST,10003-3681,10003.0,,History Museums
48,12414,60 E 42ND ST RM 1341,NEW YORK,0,0,133341914,173223,36061.0,60 E 42ND ST NEW YORK NY 10165-1341,GRUPPO ESPONENTI ITALIANI INC,A23,156438.0,157474,NY,60 E 42ND ST,10165-1341,10165.0,,Cultural & Ethnic Awareness
49,12425,3333 HENRY HUDSON PKWY,BRONX,0,9050,133358453,51610,36005.0,3333 HENRY HUDSON PKWY BRONX NY 10463-3224,U S S INTREPID ASSOCIATION INC,A12,39485.0,54494,NY,3333 HENRY HUDSON PKWY,10463-3224,10463.0,,Fund Raising & Fund Distribution
50,12429,1 CHASE PLAZA STE 13TH FL,NEW YORK,8000,0,133364852,408601,36061.0,1 CHASE PLAZA STE NEW YORK NY 10005-0000,CORNING GLASS WORKS LTD SALARIED EMPLOYEES,A40,1292510.0,1347528,NY,1 CHASE PLAZA STE,10005-0000,10005.0,,Visual Arts
51,12450,,,0,29089,133395530,81264,36061.0,,CHUNG KUO KUO MIN TANG INC,A23,0.0,145287,NY,,10013,10013.0,,Cultural & Ethnic Awareness
52,12453,165 W 46TH ST,NEW YORK,0,0,133398825,6000,36061.0,165 W 46TH ST NEW YORK NY 10036-2501,ACTORS EQUITY HOLDING CORPORATION,A65,0.0,840753,NY,165 W 46TH ST,10036-2501,10036.0,,Theater
53,12468,90 ELIZABETH STREET,NEW YORK,0,0,133418616,133641,36061.0,90 ELIZABETH STREET NEW YORK NY 10013-5566,CHINESE WEN CHOW ASSOCIATION INC,A23,11970.0,148393,NY,90 ELIZABETH STREET,10013-5566,10013.0,,Cultural & Ethnic Awareness
54,12491,385 5TH AVE,NEW YORK,0,109891,133443010,283904,36061.0,385 5TH AVE NEW YORK NY 10016-3319,NATIONAL CHINESE AMERICAN JEWELRY ASSOCIATION INC,A23,147909.0,259349,NY,385 5TH AVE,10016-3319,10016.0,,Cultural & Ethnic Awareness
55,12506,27 E BROADWAY,NEW YORK,0,0,133471375,11591,36061.0,27 E BROADWAY NEW YORK NY 10002-6804,NEW YORK CHINESE AMERICAN BANKERS ASSOCIATION INC,A23,27750.0,7276,NY,27 E BROADWAY,10002-6804,10002.0,,Cultural & Ethnic Awareness
56,12537,470 PARK AVE S FRNT 2,NEW YORK,22250,0,133498699,66503,36061.0,470 PARK AVE S FRNT NEW YORK NY 10016-6819,GLOBAL PUBLIC AFFAIRS INSTITUTE INC,A01,30500.0,30198,NY,470 PARK AVE S FRNT,10016-6819,10016.0,,Alliances & Advocacy
57,12547,13 E 16TH ST FL 6,NEW YORK,317239,436075,133506309,774407,36061.0,13 E 16TH ST NEW YORK NY 10003-3114,UNITED STATES ASSOCIATION OF IMPORTERS OF TEXTILES AND APPAREL,A40,0.0,729047,NY,13 E 16TH ST,10003-3114,10003.0,,Visual Arts
58,12599,PO BOX 872,NEW YORK,0,0,133568008,33275,36061.0,,PRIVATE ART DEALERS ASSOCIATION INC,A03,31038.0,32454,NY,,10021-0002,10021.0,,Professional Societies & Associations
59,12707,242 W 38TH ST,NEW YORK,0,95227,133670200,99936,36061.0,242 W 38TH ST NEW YORK NY 10018-5804,KOREAN APPAREL MANUFACTURES ASSOC OF GREATER NEW YORK INC,A23,0.0,95227,NY,242 W 38TH ST,10018-5804,10018.0,,Cultural & Ethnic Awareness
60,12731,245 PARK AVE,NEW YORK,0,0,133698552,3440000,36061.0,245 PARK AVE NEW YORK NY 10167-0002,QUEENRHIS FUNDING COMPANY,A60,3440000.0,3440000,NY,245 PARK AVE,10167-0002,10167.0,,Performing Arts
61,12793,PO BOX 757,NEW YORK,0,188100,133761506,175341,36061.0,,GUITAR AND ACCESSORIES MARKETING ASSOCIATION INC,A68,75000.0,263732,NY,,10033-0595,10033.0,,Music
62,12805,322 8TH AVE FL 21,NEWYORK,0,22775,133772271,32901,36061.0,322 8TH AVE NEWYORK NY 10001-6763,LEAGUE OF OFF-BROADWAY THEATRES AND PRODUCERS INC,A65,950.0,25161,NY,322 8TH AVE,10001-6763,10001.0,,Theater
63,12815,PO BOX 5005,NEW YORK,0,0,133781444,1881779,36061.0,,WALNUT CREEK PROPERTIES INC,A23,4412456.0,42820362,NY,,10163-5005,10163.0,,Cultural & Ethnic Awareness
64,12860,192 LEXINGTON AVE RM 1101,NEW YORK,0,0,133835380,9085,36061.0,192 LEXINGTON AVE NEW YORK NY 10016-6823,COMMITTEE OF FRENCH SPEAKING SOCIETIES INC,A23,2818.0,13373,NY,192 LEXINGTON AVE,10016-6823,10016.0,,Cultural & Ethnic Awareness
65,12880,3370 PRINCE ST STE 703,FLUSHING,0,39250,133853865,94741,36081.0,3370 PRINCE ST FLUSHING NY 11354-2703,AMERICAN ASSOCIATION OF CHINESE PHYSICIANS,A23,0.0,39250,NY,3370 PRINCE ST,11354-2703,11354.0,,Cultural & Ethnic Awareness
66,12907,PO BOX 1050,NEW YORK,0,0,133873175,41458,36061.0,,NETWORK OF INDIAN PROFESSIONALS INC,A23,54441.0,54542,NY,,10116-1050,10116.0,,Cultural & Ethnic Awareness
67,12922,245 PARK AVE,NEW YORK,0,0,133893891,9454052,36061.0,245 PARK AVE NEW YORK NY 10167-0002,SIXTH AVENUE ML COMPANY INC,A60,9454052.0,9454052,NY,245 PARK AVE,10167-0002,10167.0,,Performing Arts
68,12979,,,0,28730,133967440,25814,36061.0,,CONCERNED FILIPINOS FOR UNITY INC,A23,3850.0,32580,NY,,10032,10032.0,,Cultural & Ethnic Awareness
69,12988,1251 AVE OF THE AMERICAS 35TH FLR,NEW YORK,0,0,133975917,0,36061.0,1251 AVE OF THE AMERICAS NEW YORK NY 10020-1104,CRYSTAL CREEK INVESTMENT GROUP INC,A23,0.0,33841560,NY,1251 AVE OF THE AMERICAS,10020-1104,10020.0,,Cultural & Ethnic Awareness
70,13020,245 PARK AVE,NEW YORK,0,0,134005504,3576290,36061.0,245 PARK AVE NEW YORK NY 10167-0002,RIDGEWAY FUNDING COMPANY INC,A60,3576290.0,3576290,NY,245 PARK AVE,10167-0002,10167.0,,Performing Arts
71,13045,3 W 18TH ST,NEW YORK,0,0,134017838,40220,36061.0,3 W 18TH ST NEW YORK NY 10011-4610,ASSOCIATION OF MUSIC PRODUCERS INC,A68,49973.0,49973,NY,3 W 18TH ST,10011-4610,10011.0,,Music
72,13195,501 W 42ND ST,NEW YORK,48560,0,134192352,576722,36061.0,501 W 42ND ST NEW YORK NY 10036-6205,ARCHITECTURAL IRON REALTY CORP,A40,204700.0,204700,NY,501 W 42ND ST,10036-6205,10036.0,,Visual Arts
73,13215,45 E 85TH ST,NEW YORK,0,602,134218359,160333,36061.0,45 E 85TH ST NEW YORK NY 10028-0957,ASSOCIATION OF ART MUSEUM CURATORS,A50,0.0,114530,NY,45 E 85TH ST,10028-0957,10028.0,,Museums
74,13418,45 E 33RD ST,NEW YORK,77283,32089,135493557,152756,36061.0,45 E 33RD ST NEW YORK NY 10016-5336,CEMETERY DEPT OF THE WORKMENS CIRCLE INC,A23,92141.0,126592,NY,45 E 33RD ST,10016-5336,10016.0,,Cultural & Ethnic Awareness
75,13420,45 W 14TH ST,NEW YORK,5370,0,135502139,62461,36061.0,45 W 14TH ST NEW YORK NY 10011-7419,INTERNATIONAL UNION OF PAINTERS AND ALLIED TRADES,A40,72837.0,72837,NY,45 W 14TH ST,10011-7419,10011.0,,Visual Arts
76,13502,307 W 30TH ST,NEW YORK,0,0,135580391,313551,36061.0,307 W 30TH ST NEW YORK NY 10001-2703,LITHUANIAN ALLIANCE OF AMERICA,A23,52355.0,148604,NY,307 W 30TH ST,10001-2703,10001.0,,Cultural & Ethnic Awareness
77,13533,126 UNIVERSITY PL APT 5,NEW YORK,210009,409860,135606408,570667,36061.0,126 UNIVERSITY PL NEW YORK NY 10003-4571,NATIONAL LAWYERS GUILD,A20,123887.0,537653,NY,126 UNIVERSITY PL,10003-4571,10003.0,,Arts & Culture
78,13585,225 W 39TH ST RM 302,NEW YORK,0,0,135647466,21314,36061.0,225 W 39TH ST NEW YORK NY 10018-3148,PLEATERS STITCHERS & EMBROIDERERS ASSN INC,A40,19927.0,25613,NY,225 W 39TH ST,10018-3148,10018.0,,Visual Arts
79,13588,355 LEXINGTON AVE FL 17,NEW YORK,0,0,135651681,44454,36061.0,355 LEXINGTON AVE NEW YORK NY 10017-6603,COMICS MAGAZINE ASSOCIATION OF AMERICA INC,A01,10150.0,38834,NY,355 LEXINGTON AVE,10017-6603,10017.0,,Alliances & Advocacy
80,13672,400 LAFAYETTE ST RM 4,NEW YORK,0,0,136092225,11122,36061.0,400 LAFAYETTE ST NEW YORK NY 10003-6900,TEXTILE CONVERTERS LIQUIDATION BENEFIT FUND,A40,0.0,23610,NY,400 LAFAYETTE ST,10003-6900,10003.0,,Visual Arts
81,13725,125 BARCLAY ST,NEW YORK,0,0,136117924,17242,36061.0,125 BARCLAY ST NEW YORK NY 10007-2233,AMERICAN FEDERATION OF STATE COUNTY & MUNICIPAL EMPLOYEES,A50,0.0,25959,NY,125 BARCLAY ST,10007-2233,10007.0,,Museums
82,13821,205 LEXINGTON AVE RM 901,NEW YORK,376100,0,136149730,1260712,36061.0,205 LEXINGTON AVE NEW YORK NY 10016-6022,ART DEALERS ASSOCIATION OF AMERICA INC,A03,1481029.0,1454763,NY,205 LEXINGTON AVE,10016-6022,10016.0,,Professional Societies & Associations
83,14142,1501 BROADWAY,NEW YORK,0,0,136976195,0,36061.0,1501 BROADWAY NEW YORK NY 10036-5601,AMERICAN FEDERATION OF MUSICIANS OF THE US & CANADA,A68,0.0,33648,NY,1501 BROADWAY,10036-5601,10036.0,,Music
84,15025,245 PARK AVE,NEW YORK,0,0,141876785,5577610,36061.0,245 PARK AVE NEW YORK NY 10167-0002,SPOKANE BUSINESS & INDUSTRIAL FUNDING COMPANY INC,A60,5577610.0,5577610,NY,245 PARK AVE,10167-0002,10167.0,,Performing Arts
85,16391,770 BROADWAY 7TH FLOOR,NEW YORK,0,0,160876072,131025,36061.0,770 BROADWAY NEW YORK NY 10003-9522,NATO THEATRE OWNERS OF NEW YORK STATE INC,A65,21092.0,-45670,NY,770 BROADWAY,10003-9522,10003.0,,Theater
86,18207,232 3RD ST 3RD FL,BROOKLYN,42850,96203,200367608,119235,36047.0,232 3RD ST BROOKLYN NY 11215-2704,ISSUE PROJECT ROOM INCORPORATED,A61,26395.0,122619,NY,232 3RD ST,11215-2704,11215.0,,Performing Arts Centers
87,18618,,,0,64147,200851781,62851,36081.0,,TEAM JAMAICA BICKLE INC,A23,0.0,64147,NY,,11432,11432.0,,Cultural & Ethnic Awareness
88,19236,37 OVERLOOK TER APT 3E,NEW YORK,0,12600,201575771,40482,36061.0,37 OVERLOOK TER NEW YORK NY 10033-2214,SELF-HELP ASSOCIATION OF AMERICAN RUSSIAN ELDERLY,A23,29602.0,42202,NY,37 OVERLOOK TER,10033-2214,10033.0,,Cultural & Ethnic Awareness
89,20609,853 BROADWAY STE 1406,NEW YORK,318333,0,203132925,649602,36061.0,853 BROADWAY NEW YORK NY 10003-4716,AMERICAN ASSOCIATION OF INDEPENDENT MUSIC INC,A68,739409.0,748129,NY,853 BROADWAY,10003-4716,10003.0,,Music
90,23254,,,0,22655,205782277,24337,36047.0,,THEATRE OF THE EXPENDABLE,A65,0.0,26355,NY,,11231,11231.0,,Theater
91,24106,PO BOX 5005,NEW YORK,0,0,208574404,2410,36061.0,,SSPF ALISO CREEK INC,A23,883664.0,883664,NY,,10163-5005,10163.0,,Cultural & Ethnic Awareness
92,24263,,,0,68471,208794205,87814,36047.0,,ASIAN AMERICAN RESTAURANT ASSOCIATION CORP,A23,0.0,68471,NY,,11237,11237.0,,Cultural & Ethnic Awareness
93,24389,,,0,56495,208970506,38497,36061.0,,REGIONAL TIBETAN WOMENS ASSOCIATION OF NEW YORK AND,A23,0.0,56495,NY,,10016,10016.0,,Cultural & Ethnic Awareness
94,26734,156 W 56TH ST STE 1902,NEW YORK,0,24850,222701258,220978,36061.0,156 W 56TH ST NEW YORK NY 10019-3922,BOOKBINDERS GUILD OF NEW YORK INC,A20,216196.0,242945,NY,156 W 56TH ST,10019-3922,10019.0,,Arts & Culture
95,27560,419 PARK AVENUE SOUTH #12,NEW YORK,0,0,223199519,0,36061.0,419 PARK AVENUE SOUTH #12 NEW YORK NY 10016,ASSOC OF INDIAN IN CONSTRUCTION IND INC,A23,0.0,17321,NY,419 PARK AVENUE SOUTH #12,10016,10016.0,,Cultural & Ethnic Awareness
96,28651,PO BOX 610533,BAYSIDE,0,0,226067322,19696,36081.0,,DANCE MASTERS OF AMERICA NEW YORK CITY CHAPTER INC,A62,26270.0,26270,NY,,11361-0533,11361.0,,Dance
97,33938,730 BROADWAY,NEW YORK,6000,0,237055265,100288,36061.0,730 BROADWAY NEW YORK NY 10003-9502,ST LOUIS TEXTILE PROCESSORS LOCAL 108 WELFARE FUND GROUP 1200,A40,70202.0,201418,NY,730 BROADWAY,10003-9502,10003.0,,Visual Arts
98,42202,99 PARK AVE RM 1700,NEW YORK,113020,0,237411166,268447,36061.0,99 PARK AVE NEW YORK NY 10016-1609,LIBERIAN SHIPOWNERS COUNCIL LTD,A23,299007.0,304244,NY,99 PARK AVE,10016-1609,10016.0,,Cultural & Ethnic Awareness
99,42831,61 MARTENSE ST APT 5A,BROOKLYN,0,0,237444871,81150,36047.0,61 MARTENSE ST BROOKLYN NY 11226-3236,CIVIL SERVICE EMPLOYEES ASSOCIATION,A57,68930.0,76791,NY,61 MARTENSE ST,11226-3236,11226.0,,Science & Technology Museums
100,48128,,,330960,0,260460046,3231582,36061.0,,CONCAR ACQUISITION COMPANY INC,A60,7013047.0,7024481,NY,,10163,10163.0,,Performing Arts
101,48164,PO BOX 5005,NEW YORK,0,0,260509362,300,36061.0,,FOURTH & HARRISON FUNDING COMPANY INC,A60,2421703.0,2421703,NY,,10163-0000,10163.0,,Performing Arts
102,48192,PO BOX 5005,NEW YORK,0,0,260542856,5967,36061.0,,URBAN W FUNDING COMPANY,A60,828200.0,828200,NY,,10163-0000,10163.0,,Performing Arts
103,48359,PO BOX 5005,NEW YORK,0,0,260744293,300,36061.0,,MIRAMAR FUNDING COMPANY,A60,64359.0,64359,NY,,10163-0000,10163.0,,Performing Arts
104,48426,,,0,0,260837381,66947,36061.0,,PUSHKIN RUSSIAN SOCIETY,A23,66565.0,66565,NY,,10021,10021.0,,Cultural & Ethnic Awareness
105,49457,207 CANAL ST FL 3,NEW YORK,0,57973,262752840,73810,36061.0,207 CANAL ST NEW YORK NY 10013-4125,CHAO CHIU ASSOCIATION INC,A20,0.0,58977,NY,207 CANAL ST,10013-4125,10013.0,,Arts & Culture
106,49912,,,0,25750,264321526,24039,36061.0,,BLACK AND HISPANIC CAUCUS OF THE NYC COUNCIL INC,A23,0.0,25750,NY,,10007,10007.0,,Cultural & Ethnic Awareness
107,50103,291 8TH ST,BROOKLYN,0,0,270207636,72594,36047.0,291 8TH ST BROOKLYN NY 11215-3313,MAGIS THEATRE COMPANY INC,A65,85548.0,85923,NY,291 8TH ST,11215-3313,11215.0,,Theater
108,50485,PO BOX 250807,NEW YORK,0,0,300379922,22226,36061.0,,ETHIOPIAN EDIR MUTUAL ASSISTANCE ASSOCIATION IN NEW YORK INC,A23,33480.0,35954,NY,,10025-1509,10025.0,,Cultural & Ethnic Awareness
109,50548,890 BROADWAY,NEW YORK,0,135120,300459786,20468,36061.0,890 BROADWAY NEW YORK NY 10003-1211,ABT DANCERS BENEFIT TR FUND,A62,0.0,135889,NY,890 BROADWAY,10003-1211,10003.0,,Dance
110,54628,70 UNIVERSITY PL APT 5,NEW YORK,0,23834,320176279,99331,36061.0,70 UNIVERSITY PL NEW YORK NY 10003-4554,THE MICHAEL CHEKHOV THEATRE COMPANY INC,A65,71098.0,94932,NY,70 UNIVERSITY PL,10003-4554,10003.0,,Theater
111,54708,,,0,0,320280830,7869203,36061.0,,FRM Funding Company Inc,A60,7869203.0,7869203,NY,,10167,10167.0,,Performing Arts
112,54998,875 SIXTH AVE STE 2302,NEW YORK,447607,579638,330274349,1230139,36061.0,875 SIXTH AVE NEW YORK NY 10001-3507,THEATRICAL DEALERS ASSOCIATION,A65,571153.0,1306627,NY,875 SIXTH AVE,10001-3507,10001.0,,Theater
113,62432,PO BOX 20309,NEW YORK,0,67500,352237120,52323,36061.0,,MUSIC ACCORD INC,A68,0.0,67661,NY,,10025-1519,10025.0,,Music
114,63010,PO BOX 757,NEW YORK,0,0,356048417,61066,36061.0,,NATIONAL ASSOCIATION OF BAND INSTRUMENT MANUFACTURERS INCORPORA,A6C,28000.0,28162,NY,,10033-0595,10033.0,,Bands & Ensembles
115,70023,PO BOX 8026,NEW YORK,0,45629,371544155,39226,36061.0,,THE REAL THEATRE COMPANY,A65,0.0,45629,NY,,10150-8026,10150.0,,Theater
116,81729,245 PARK AVE,NEW YORK,0,0,412244534,869440,36061.0,245 PARK AVE NEW YORK NY 10167-0002,HAWTHORNE GATES FUNDING COMPANY INC,A60,869440.0,869440,NY,245 PARK AVE,10167-0002,10167.0,,Performing Arts
117,85369,730 BROADWAY,NEW YORK,3000,0,430721295,84753,36061.0,730 BROADWAY NEW YORK NY 10003-9502,TEXTILE PROCESSORS LOCAL 108 WELFARE FUND GROUP 1053,A40,29055.0,31596,NY,730 BROADWAY,10003-9502,10003.0,,Visual Arts
118,93762,1300 MORRIS PARK AVE STE B502,BRONX,0,0,510192888,83665,36005.0,1300 MORRIS PARK AVE BRONX NY 10461-1900,NEW YORK OBSTETRICAL SOCIETY INC,A69,0.0,72865,NY,1300 MORRIS PARK AVE,10461-1900,10461.0,,Symphony Orchestras
119,94639,7 W 96TH ST,NEW YORK,0,0,510244825,51669,36061.0,7 W 96TH ST NEW YORK NY 10025-6540,KING SOLOMON-BEETHOVEN LODGE NO 232,A68,13959.0,47373,NY,7 W 96TH ST,10025-6540,10025.0,,Music
120,97449,9120 95TH AVE,OZONE PARK,0,0,521592386,1848,36081.0,9120 95TH AVE OZONE PARK NY 11416-1413,POLISH FALCONS OF AMERICA,A23,0.0,11171,NY,9120 95TH AVE,11416-1413,11416.0,,Cultural & Ethnic Awareness
121,98102,52 VANDERBILT AVE STE 20TH FL,NEW YORK,0,0,521902671,160911,36061.0,52 VANDERBILT AVE STE NEW YORK NY 10017-3808,BRITISH-AMERICAN BUSINESS COUNCIL,A23,36380.0,150718,NY,52 VANDERBILT AVE STE,10017-3808,10017.0,,Cultural & Ethnic Awareness
122,101619,111 E 14TH ST PMB 157,NEW YORK,0,125,541585995,75287,36061.0,111 E 14TH ST PMB NEW YORK NY 10003-4103,NATIONAL ASSOCIATION OF INDEPENDENT PUBLISHERS REPRESENTATIVES INC,A03,61971.0,62096,NY,111 E 14TH ST PMB,10003-4103,10003.0,,Professional Societies & Associations
123,111205,230 PARK AVE 12TH FLOOR,NEW YORK,0,0,582648602,6600,36061.0,230 PARK AVE NEW YORK NY 10169-0005,ERS PLAZA MUSEUM INC,A50,0.0,30311,NY,230 PARK AVE,10169-0005,10169.0,,Museums
124,114785,1251 AVE OF THE AMERICAS 35TH FLR,NEW YORK,0,0,593334243,0,36061.0,1251 AVE OF THE AMERICAS NEW YORK NY 10020-1104,INDIAN RIVER APARTMENTS INC,A23,0.0,11075284,NY,1251 AVE OF THE AMERICAS,10020-1104,10020.0,,Cultural & Ethnic Awareness
125,117133,,,0,0,611525151,1485600,36061.0,,JOULE FUNDING COMPANY INC,A60,1485600.0,1485600,NY,,10167,10167.0,,Performing Arts
